,title,text
49,0,liverpool fan stand outsid unabl time lead match be delay prior uefa champion leagu final match between liverpool real madrid stade franc saint deni north pari presid emmanuel macron urg french govern wednesday investig with full transpar chao last weekend champion leagu final between liverpool real madrid interior minist came under increas pressur over polic handl mayhem outsid stade franc stadium ahead match which thousand liverpool support with ticket struggl enter polic respond with tear rais question over capac pari host olymp game french interior minist gerald darmanin face accus lie after blame chao massiv ticket scam admit that organis could clearli have been better govern spokeswoman olivia gregoir said that matter been briefli discuss wednesday regular cabinet meet chair macron comment publicli what presid want that light shone what realli happen full transpar veri quickli told report while emphasis darmanin macron full confid said macron also expect action from govern ensur that thi never happen again simpli could have done thing better could have been better manag acknowledg were there wound tragedi improv thing futur sport event certainli confirm that support been unabl watch match chao presid republ govern sorri these peopl lost despit public profess support french media report said that macron privat furiou with darmanin high fli right winger canard enchain satir weekli said that macron told darmanin that what happen heavi blow franc that furiou cite sourc close macron say minist interior expressli ask step stop insist that were blame sourc ad darmanin sport minist ameli oudea castera appear later wednesday befor senat committe hear face question about secur game which tarnish franc imag ahead host rugbi world next year olymp appear adopt slightli more conciliatori tone initi remark darmanin admit there been shortcom clearli thing could have been organis better evid that thi celebr sport ruin veri much regret troubl which were sometim unaccept said footbal fan neg imag thi match wound nation pride said avoid worst could have prepar better without doubt said darmanin said that mani percent ticket were found fraudul staff first secur checkpoint outsid stade franc brandish real ticket fake ticket make point darmanin said that some entri ticket been forg trickster hundr time over express regret over disproportion tear say sanction will taken against offic charg french right leader marin suggest darmanin should resign after defend french polic blame ticket counterfeit chao fact extrem seriou minist extrem seriou told franc televis other democraci face with such fiasco with chao that occur front million peopl watch televis which offer dread imag franc then should consid himself that should resign ad leftw liber newspap depict darmanin front page wednesday with nose stretch like pinocchio newspap editori headlin said final risk remain annal republ long even after been forgotten footbal fan scene have caus renew tension between franc britain whose tie alreadi strain have becom domest polit headach govern less than week befor parliamentari elect come alway look way improv stori know what like what improv emerg that last minut intervent presid kenyatta facilit musyoka return azimio fold from cent household head singl parent number shot stagger four three year thi will karua first visit nyanza sinc unveil odinga run mate have blocker pleas disabl reload page again later nation media group welcom
50,1,infospac ultim inform space thi watermelon farm guid full guid enabl start grow your watermelon farm whether commerci domest purpos intend answer question regard water melon farm kenya thi guid watermelon flower plant speci cucurbitacea famili name edibl fruit scrambl trail vine like plant origin domest africa highli cultiv fruit worldwid with more than varieti wikipedia befor ventur into watermelon farm kenya there some question usual yourself some these question regard watermelon farm includ plant watermelon watermelon fruit warm weather crop with optim temperatur be degre celsiu degre celsiu lower temperatur result lower yield qualiti watermelon crop doe well loami well drain soil rich nutrient slightli acid grown heavi soil crop grow slowli fruit size usual qualiti watermelon crop flourish region with optimum rainfal crop season irrig import order ensur consist moistur avail order excel result from your watermelon plantat choic seed veri import some commonli use varieti includ sukari zuri kubwa sugar babi crimson sweet sweet rose hybrid seed prefer product qualiti fruit these avail agrovet agro dealer shop seed requir direct sow watermelon acr piec land ensur land plant watermelon prepar properli water melon space metr between row meter from crop other vine requir enough space their spread appli fertil rate kilogram acr thi equival teaspoon plant home recommend watermelon becaus higher amount phosphoru phosphoru use proper root develop watermelon watermelon seed hole depth centimetr centimetr recommend plant after plant watermelon farm regular farm practic continu these farm practic includ mulch thi done ad materi such grass wast beneath soil ensur watermelon plant conserv moistur also weed suppress irrig thi done applic water plant mainli even ensur frequent adequ moistur suppli watermelon grow with enough moistur increas product weed thi done uproot unwant plant that grow with watermelon ensur that pest diseas prevent also competit nutrient with plant reduc discourag vine prune prune watermelon includ remov leav vine fruit thi ensur that vine focu energi remain fruit when prune watermelon remov these should remov junction where they connect main vine make sure prune when leav prevent spread watermelon diseas prune your watermelon vine leav maximum vine plant need harvest bigger watermelon remov deform tini fruit leav maximum watermelon fruit vine watermelon yield vari accord varieti gener mainten crop howev acr land favour ecolog condit under good mainten produc tonn watermelon pest diseas affect watermelon aphid aphid major pest caus leav curl becom unattract custom aphid feed suck plant small aphid popul rel harmless heavili infest plant usual have wrinkl leav stunt growth deform pod plant particular young plant under heavi aphid attack heavi attack older plant caus crop loss decreas product damag also reduc seed viabil spider mite plant leav growth tip suscept mite veri small suck arthropod that result twist growth product gener spider mite feed caus reduct plant growth flower number length berri number seed berri damag most sever when mite attack young plant mite damag particularli sever dure season both organ inorgan pesticid use control pest diseas your watermelon veget seek advic from agricultur extens worker pest diseas identif manag harvest watermelon harvest watermelon start about month after plant depend varieti ecolog factor harvest best done earli morn when field heat fruit most turgid depend varieti seed plant your watermelon will readi harvest day befor harvest your watermelon fruit need determin they matur readi harvest harvest immatur fruit will lead loss matur indic harvest done cut vine near fruit pleas note that should pull twist break watermelon vine make sure leav stalk attach watermelon fruit watermelon fruit continu ripen after harvest harvest when they immatur watermelon fruit will continu develop colour flesh there will increas sugar content thi mean harvest qualiti watermelon need sure that they readi harvest watermelon fruit should transport close truck store with ethylen produc produc like banana thi caus them break intern flesh becom water soak soft loss sweet flavour watermelon market high demand watermelon provid readi market thi kind fruit watermelon sold infospac mediateam will keep updat concern watermelon farm updat thi articl cover sever other area which includ subscrib farm sidehustl youtub channel here learn more about farm agribusi sign newslett receiv updat email millet farm guid veri help inform farmer keep your email address will publish requir field mark comment name email websit save name email websit thi browser next time comment
51,0,good sleep hygien increas your energi level throughout fiona muthoni struggl rest sleep night alon there way sleepless night begin with durat qualiti your sleep determin whether will wake feel refresh next discuss tip that will give that rejuven sleep identifi what time need wake morn thi will make easier your bodi brain adapt onc have identifi time self disciplin chang habit that disrupt sound sleep pattern bedtim stick even tire habit go differ time everi night will difficult your bodi mind use thi schedul earli bedtim even tire becaus have control over your bodi allow stay track with daili routin without mental strain caus lack rest night reduc blue light exposur befor go sleep turn electron exposur blue light from electron devic such televis smartphon tablet prevent melatonin product make harder fall asleep when final into cours have electron after certain time night limit your work around thi instal free app which reduc amount blue light from your screen creat relax sleep routin thi most import aspect maintain healthi sleep hygien make break your effort more rest night take some time effort find what work onc effect sleep routin will help clear your mind from remain anxieti that might creep befor bedtim exampl some peopl prefer read book befor go sleep while other find easier listen soft music even take bath shower beforehand engag activ that stimul such watch action movi late night which leav your mind run wild with thought what will happen next avoid caffein after alcohol night have troubl with your sleep cycl back your caffein intak afternoon even caffein known stimul brain therefor best avoid hour befor bedtim make consciou effort drink more water throughout which eventu reduc even caffein beverag altogeth likewis should back alcohol intak after dinner although initi make feel sleepi relax much alcohol interrupt your sleep cycl caus disrupt rapid movement stage your sleep exercis regularli good idea exercis regularli becaus help your bodi tire readi sleep howev recommend that thi right befor go sleep increas blood flow energi level from physic activ make difficult your mind bodi into rest mode exampl right befor turn night chanc that onc your head hit pillow least part your bodi more will still activ will difficult fall asleep likewis have troubl sleep stay away from potenti stress activ your reduc stress level that alreadi prevent from get good night rest benefit good sleep hygien fortun differ treatment avail today insomnia today they includ prescript medic over counter sleep aid cognit behaviour therapi effect get enough sleep includ irrit anxieti problem concentr rememb thing weight gain increas risk diabet emerg that last minut intervent presid kenyatta facilit musyoka return azimio fold from cent household head singl parent number shot stagger four three year thi will karua first visit nyanza sinc unveil odinga run mate have blocker pleas disabl reload page again later nation media group welcom
52,1,butternut squash type pumpkin that pear shape light brown cream colour when matur began grow after talk with some market trader told that butternut popular among mother wean their children thought veri nutriti good combin with some mash potato plantain some green thu figur that would good plant ventur into children born everyday figur butternut sold piec accord size although prefer one some reason veri size farm produc local market prefer have alway wonder thi some market trader told larger size onli prefer hotel food eateri found that butternut varieti avail weren that thu chose could find work direct drill which sow seed directli where will grow without plant seedb first space done right from pumpkin famili thu they long vine grew mine greenhous tunnel plant crop rotat programm maxim space usag pant use similar space tomato from germin butternut veri fussi grow other than water onli other thing look fungal infect which affect most plant curcubit famili plant doe grow fast produc leav vine have prune remov some vine tri maxim space plant trellis problem encount that butternut becom heavi they matur have fruit ground have support directli beneath them harvest good readi market about month took produc market first time butternut taken market trader howev after week trader took less less butternut seem like there glut onli farmer that produc butternut market becam problem sold less less butternut over that grow season onli save grace butternut that they have good shelf life kept cool place they keep about month thi point which figur wasn good ventur regular incom also talk farmer tri butternut ventur told that found that market produc some point product cycl seem that didn have veri strong demand would plant again from experi plu talk with other farmer would grow butternut squash commerci endeavour back farm journey
53,0,merci gakii muiruri head investor relat kenya pension fund invest consortium wanja mbuthia merci gakii muiruri head investor relat kenya pension fund invest consortium kepfic consortium privat public pension scheme that have come togeth explor invest opportun infrastructur altern invest better return portfolio diversif share career path with nation head investor relat kenya pension fund invest consortium kepfic have year experi pension manag invest bank insur passion about pension invest therefor give much satisfact make thi contribut pension industri alway eager give best beyond whatev born rais kibirichia meru counti famili five father colleg lectur athlet coach while mother still teacher brought fairli primari school finish secondari educ kaaga girl which progress univers nairobi bachelor commerc later graduat with master scienc financ special invest have cisi certif qualifi client face invest advisor also read sarah najmudin greatest decis made employ myself began career immedi after undergradu degre intern remu microfin where account clerk later with heritag insur medic depart financ offic first charg reconcili later promot compani financ depart invest analyst where main role manag compani invest there massiv redund lost luckili just finish master degre over year creat awesom network abl consult gig that built passion invest manag within year join african allianc invest bank where work with invest portfolio manag team client relat busi develop investor report relat left african allianc join enwealth financi servic pension administr region busi develop consult where specif task with launch subsidiari uganda head famili dynam left after month find less travel local posit join kenya busi develop strategi manag advisori depart role drive busi advisori growth increas revenu covid busi advisori struggl took career break after realiz expect child year break rais kid amaz abl bounc back work with kepfic where champion pension scheme play part close billion infrastructur kenya invest their portfolio infrastructur altern invest retir benefit author guidelin pride myself work complet market head busi entiti there make differ while african allianc colleagu charg east africa left matern step thi greatest opportun career becaus end be assign head busi uganda later be contract enwealth financi servic launch them offic uganda sign client within first month exist same pride have current when impact influenc have pension industri drive consortium membership bring more pension scheme board see through first infrastructur invest fund pension scheme countri husband alway been number cheerlead while do master would actual tran night give moral support regardless be businessman while busi with work step help with kid alway been person assist advisor career famili have disciplin children awesom mother sister present love mother phone call away niec preciou hous help thi support reason growth becaus alway peac they push better everi while call travel work easi wouldn even know have year becaus support from peopl four year made decis alway make differ peopl live peopl mean stranger took girl from veri poor background score best those upcountri public school when heart melt bright focus given ahead take consid first born have mentor never down will sit kenya certif secondari educ exam decemb materi want neurosurgeon turn good that pride myself much take career break rais child first scare hope confid came from support spous expect child easi pregnanc mostli bedridden rest thi break gave time reflect refresh career path abl exclus breastfe babi after health better abl start hunt process final what meant happen head investor relat membership outreach kenya pension fund invest consortium kepfic respons lead pension fund kenya into sustain infrastructur altern invest invest entail investor relat membership manag develop strategi depart perform track report commun market capac build support learn save know thing tight priorit need compar need other pressur yourself tri impress your peer walk your pace will make then work organ that pension scheme pleas take interest understand invest that your scheme invest thi your futur take control those truste posit need younger gener those boardroom just began thi movement that intend grow privat sector financ infrastructur project countri kenya self reliabl thi wish passion thi career wish come true life alreadi done with kid plan give them best love work time week hike take part differ work challeng bucket list program perfect consid past greatest contribut what today what today becaus imperfect past have grown thank past thi email protect come alway look way improv stori know what like what improv emerg that last minut intervent presid kenyatta facilit musyoka return azimio fold from cent household head singl parent number shot stagger four three year thi will karua first visit nyanza sinc unveil odinga run mate have blocker pleas disabl reload page again later nation media group welcom
54,0,herd zebra graze tsavo west nation park taita taveta counti thi photo taken decemb hilari kimuyu nation media group netflix docuseri great nation park take viewer nation park around world from chilean patagonia kenya tsavo east nation park sooth narrat show execut produc former presid barack obama ever been kilaguni serena safari lodg taken tour with them been long savour travel sight sound particularli after year covid link lockdown then view thi invit unveil ravishingli vari landscap seascap surpris anim escapad mani locat featur seri were select becaus obama person connect park thi clear when introduc kenya biggest nation park first time visit kenya about year stranger say obama thi land father pass away whom bare knew famili visit villag that they came from felt welcom everywher sister spent day safari felt someth els african bush swept forev with wide open sky wildlif that never seem what gift world anew place where ultim come from joann scofield produc director third episod that about tsavo remark that super tusker super elus there onli these enorm icon eleph left africa tsavo home third them find such vast area easi task with support tsavo trust kenyan wildlif servic were fortun enough seek film oldest bull spent entir with swagger between waterhol check herd even fell asleep hour lean gigant tusk honour accompani through bush spend time huge presenc said accord henrietta karimi manag serena lodg crew camp hotel month ad that they even convert room into studio knew they were film someth import becaus equip they didn know documentari that narrat obama wish also visit said documentari obama say bariton voic sight dust eleph wallow roll spray each other with midnight blue water palm shade galana river most evoc imag africa goe thi along with kilometr long yatta plateau longest lava flow world make adventur unlik other tsavo east park form largest protect area kenya home most largest mammal planet produc documentari said they expedit countri five contin film over day they were also work with number peopl each countri which onli allow them minimis travel also help them when pandem were reli peopl countri they were give such uniqu rare perspect their nation park becaus cours them they their backyard they place that they most connect said execut produc jame honeyborn documentari current stream netflix come alway look way improv stori know what like what improv emerg that last minut intervent presid kenyatta facilit musyoka return azimio fold from cent household head singl parent number shot stagger four three year thi will karua first visit nyanza sinc unveil odinga run mate have blocker pleas disabl reload page again later nation media group welcom
55,0,infertil common challeng relationship simon mburu after marriag rel neighbour usual begin count day until babi arriv expect that babi will follow soon after coupl get marri realiti that sometim babi take long come doe come blame delay childbirth childless marriag usual seen fault woman realiti that male infertil factor childless what statist infertil rise kenya accord data from kenya fertil societi least everi five coupl suffer from infertil data also estim that least million kenyan requir medic assist conceiv most common reproduct problem sperm count zero sperm count block tube world health organ attribut percent infertil case percent both women kenya fertil societi attribut percent infertil case percent women percent unknown factor impot infertil impot also refer erectil dysfunct inabl maintain erect other hand infertil also refer steril refer inabl make releas sperm with impot sexual intercours imposs with infertil possibl concept imposs look caus impot psycholog impot psycholog impot condit which unabl erect struggl erect difficulti maintain erect psycholog trigger gitobu mburugu consult urologist kenyatta nation hospit chair kenya associ urolog surgeon say that thi form impot rise among younger otherwis have erectil problem impot wit increas number sexual traumatis young with psycholog impot pressur perform expect perpetr societi contain pornograph materi say medic impot endocrin diseas such diabet lead medic impot endocrin disord affect endocrin system which produc hormon that regul among other reproduct mood sexual function metabol condit such high cholesterol high blood pressur associ with increas risk impot accord alana bigger intern medicin physician chronic diseas epidemiologist author chronicl women white coat have diabet risk impot come from nerv damag which affect your penil sensat impair blood flow hormon level there neurolog condit such brain tumor stroke alzheim parkinson diseas which affect your abil stay fertil medic surgic procedur drug such cimetidin use cancer chemotherapi prostat surgic procedur induc impot say lifestyl impot lifestyl habit such excess drink smoke poor diet obes live sedentari lifestyl make difficult have maintain erect instanc research studi unit kingdom centr biotechnolog inform found that intens cigarett smoke directli link degre sever impot infertil caus impot close relat caus infertil diabet cancer treatment through chemotherapi radiat commonli share caus bigger say that injuri infect testicl abus certain drug such steroid sexual transmit diseas such gonorrhea genet condit such cystic fibrosi result infertil there also condit known retrograd ejacul which sperm flow into bladder translat infertil say cope your spous have been unsuccess tri babi both advis checkup mburugu say that should make assumpt over counter pill without prescript best treat erectil dysfunct infertil medic diagnosi treatment enhanc drug say effect treatment will depend psycholog physic healthi thi mean that need healthi diet exercis quit smoke excess drink embrac intimaci cuddl hold hand commun your feel fear your partner openli gentli stay optimist that will your groov back spontan dinner date start explor sensual place sexual say psychologist munyua vasectomi impact sexual perform orgasm sexual desir ejacul erectil capabl your prostat gland includ semin vesicl remov dure surgeri will have orgasm dure intercours accord journal emerg that last minut intervent presid kenyatta facilit musyoka return azimio fold from cent household head singl parent number shot stagger four three year thi will karua first visit nyanza sinc unveil odinga run mate have blocker pleas disabl reload page again later nation media group welcom
56,1,editor will review what submit determin whether revis articl crop agricultur plant plant product that grown harvest extens profit subsist crop fall into categori food crop human consumpt wheat potato feed crop livestock consumpt oat alfalfa fibr crop cordag textil cotton hemp crop consumpt industri use cottonse corn ornament crop landscap garden dogwood azalea industri secondari crop variou person industri use rubber tobacco
