,title,text
96,1,infospac ultim inform space thi grow managu african nightshad full guid enabl start grow your managu farm whether commerci domest purpos intend answer question regard managu farm kenya thi guid narrow leav african nightshad also call managu swahili wide distribut throughout tropic found throughout east africa befor ventur into managu farm kenya there some question usual yourself some these question regard managu farm includ plant african nightshad plant seed rate african nightshad managu acr ensur purchas onli certifi seed plant done prepar nurseri first simpli plant directli well prepar field nurseri prepar loosen nurseri soil appli well decompos manur make sure that manur well incorpor into soil make drill that centimet apart where will then seed cover them lightli with soil also choos rais nurseri loosen soil size nurseri will depend amount african nightshad want plant regular farm practic nurseri which includ water onc daili especi even weed thin continu african nightshad seedl will readi transplant day after seed when they have true leav height between centimet land where veget transplant should readi fertil free from weed area that fertil phosphoru fertil should appli form rate acr field transplant plant seed alreadi prepar row apart with space between plant be ensur uproot seedl from nurseri after applic water ensur soften soil avoid loos root hard soil after transplant your african night shade seedl farm regular farm practic continu period about week when veget have adapt these farm practic includ mulch thi done ad materi such grass wast beneath soil ensur african nightshad plant conserv moistur also weed suppress irrig thi done applic water plant mainli even ensur frequent adequ moistur suppli managu veget although thi veget drought resist import grow with enough moistur increas product weed thi done uproot unwant plant that grow with african nightshad ensur that pest diseas prevent also competit nutrient with plant reduc discourag collard cabbag broccoli best intercrop partner african nightshad research egerton univers kenya shown that intercrop crop from nightshad famili increas leaf yield kale sukuma wiki pest diseas affect african nightshad aphid aphid major pest caus leav curl becom unattract custom aphid feed suck plant small aphid popul rel harmless heavili infest plant usual have wrinkl leav stunt growth deform pod plant particular young plant under heavi aphid attack heavi attack older plant caus crop loss decreas flower seed product damag also reduc seed viabil spider mite plant leav growth tip suscept mite veri small suck arthropod that result twist growth product gener spider mite feed caus reduct plant growth flower number length berri number seed berri damag most sever when mite attack young plant mite damag particularli sever dure season earli blight leaf spot earli blight circular brown often show circular pattern which distinguish thi diseas from other leaf spot earli blight thrive best under warm condit leaf spot first appear oldest leav progress upward plant entir plant could defoli kill control earli blight onc establish veri difficult most import control earli blight attempt prevent establish further spread both organ inorgan pesticid use control pest diseas your managu veget seek advic from agricultur extens worker pest diseas identif manag harvest african nightshad african nightshad readi harvest start from week after transplant stem approxim abov ground thi allow side shoot develop pick done weekli interv pick should done veri earli morn produc sold same altern managu crop harvest late afternoon place banana leav these should tie small bundl flower should remov befor crop taken market water these bundl sparingli retain fresh crop thi method harvest most prefer give farmer continu produc month remov flower regularli ensur managu plant continu produc more leav instead focus resourc develop fruit market african nightshad high demand african nightshad veget provid readi market thi kind veget import note that thi crop highli perish veget harvest should done with readi market likewis refriger done place stem cold water keep them fresh managu sold yield acr african nightshad between tonn tonn acr depend manag varieti managu plant spinach farm guid good guidelin variou horticultur produc your email address will publish requir field mark comment name email websit save name email websit thi browser next time comment
97,1,began think sorghum viabl fodder crop anim when attend agricultur show area there sorghum varieti from seed compani that look quit impress tall taller than tallest maiz crop show also foliag which figur good especi fodder cow sorghum grow field immedi began plan grow sorghum farm there were mani varieti sorghum came find later they were equal show actual went stand compani with impress varieti sorghum when enquir whether could purchas some sorghum seed inform that they were sold couldn believ just second show told that onli could seed contact head offic long stori short long wait befor seed meantim deter from dream sorghum farm fodder decid anoth sorghum varieti first thi more commonli avail dual purpos could use human food fodder cow plant trial begun first sorghum varieti grow impress varieti mind bare feet tall less foliag than what thought would also seem affect some sort diseas that would turn leav with spotti mark leav older plant grew second trial white sorghum varieti sorghum still have good varieti after decid thi sweet varieti howev been advis that better suit lower warmer climat person buy from said that perform well even high altitud zone thi well plant bare feet tall foliag veri disappoint thi varieti didn even wait second crop loss plough first varieti tri grow second time from cut there sorghum varieti from differ compani that import sold fodder crop serious look into establish sorghum main fodder crop tri grow slightli better than sweet varieti equal unimpress height foliag plough thi varieti after first harvest final abl sorghum varieti seen agricultur show almost year befor howev call favor connect seed needless expens affair seed cost about time cost other type tri hope thi varieti disappoint grew quit well compar other varieti where soil fertil enough sorghum grew minimum feet tall foliag from plant from seed usual about good harvest crop make silag howev consecut harvest reduc usual plough after everi harvest main reason will pursu sorghum fodder crop that varieti after foliag also plu that sorghum grow again from cut left drawback read regard sorghum fodder possibl cyanid poison thi especi true area sorghum grown there drought when grow there prevent cyanid poison consumpt sorghum fodder ensil sorghum greatli reduc even elimin risk cyanid poison term perform dairi cow seem slightli less well when sorghum silag compar maiz silag would grow again believ slightli lower energi valu sorghum compar maiz offset fact that harvest more than onc risk poison be elimin ensil mean that view worth plant intend have some sorghum crop long do dairi farm other reason would prefer grow sorghum that there plenti wildlif around that quit nuisanc thi especi maiz porcupin monkey alway know when crop just about readi cant enough same true sorghum which they show interest back farm journey
98,1,infospac ultim inform space thi poultri farm kenya full guid answer your question inform need start grow your poultri farm kenya befor start poultri farm kenya probabl have ask yourselv some these mani question cover these question mani more enabl start your poultri farm kenya from scratch inform thi guid clearli research proven regard trend poultri farm kenya start poultri farm kenya select poultri type poultri farm kenya veri profit ventur thi guid go take depth knowledg chicken thi becaus most kept bird poultri farm kenya other type poultri kept includ under poultri type there also select chicken type kept whether kienyeji kuroil other list here tabl below help choos your prefer type kari kienyeji thi bred from rang indigen chicken kenya kari karlo naivasha there five distinct type distinguish their color kuroil thi breed enter kenya from uganda origin from india kenbro thi kenchick breed rainbow rooster thi multi color breed origin from india here summar tabl show differ kienyeji chicken breed with their characterist busi plan after have select your prefer type poultri bird which thi articl will base chicken have busi plan your farm choos start small commerci poultri farm larg scale poultri commerci farm also plan just domest poultri farm either thi where need have busi plan occur start commerci poultri farm kenya some thing should consid plan financ object your poultri farm budget your poultri farm resourc requir start your poultri farm profit gener long term thi rocket scienc there mani establish poultri farmer kenya make profit decent incom from their commerci poultri farm keep mind that small domest poultri farm kenya requir smaller space less capit compar larger commerci poultri farm poultri hous start manag your poultri well need have correctli establish poultri farm good hous your poultri veri import will help poultri hous kenya should consid commerci goal your poultri farm rear method scale your poultri farm condit place farm whether urban rural area there sever style creat simpl complex poultri farm hous need search way creat your simpli hire expert develop good hous much space need your poultri regard thi question common estim vari mostli common space need poultri feet insid bird depend size chicken chicken insid hous should least squar feet foot rectangl also consid feet high give comfort space insid poultri hous calcul amount chicken will keep just chicken squar feet rule good frequent ask question kindli note that calcul base current market price which vari with time with your local also worth note that estim broadli base major expens hous servic type breed need acquir calcul amount chicken will keep just chicken squar feet rule good start poultri farm that hard beginn thank avail onlin resourc where thorough research also thi guid should help with knowledg thi guid choos start small poultri farm your choic also keep mind that there other numer piec inform avail onlin free there mani success stori poultri farmer kenya which keep motiv start alway check interview testimoni youtub real life inform there variou factor gaug money capit need poultri busi some factor size farm need type poultri mani other factor sure check next busi newslett updat regard thi subscrib newslett use your email more updat interest rais chicken beginn have suffici space your email address will publish requir field mark comment name email websit save name email websit thi browser next time comment
99,1,editor will review what submit determin whether revis articl shift agricultur system cultiv that preserv soil fertil plot field rotat distinct from crop rotat shift agricultur plot land clear cultiv short period time then abandon allow revert natur veget while cultiv move anoth plot period cultiv usual termin when soil show sign exhaust more commonli when field overrun weed length time that field cultiv usual shorter than period over which land allow regener lie fallow land clear system shift agricultur slash burn method which leav onli stump larg tree field after stand veget been down burn ash enrich soil cultiv earth after clear usual accomplish dig stick plow shift agricultur frequent been attack principl becaus degrad fertil forestland tropic region nevertheless shift agricultur adapt tropic soil condit region where long term continu cultiv same field without advanc techniqu soil conserv fertil would extrem detriment fertil land such environ prefer cultiv field short period then abandon befor soil complet exhaust nutrient also slash burn agricultur
100,1,editor will review what submit determin whether revis articl editor will review what submit determin whether revis articl cultiv agricultur horticultur loosen break till soil more gener rais crop soil around exist plant cultiv hand use machin use cultiv destroy weed promot growth increas soil aerat water infiltr soil be prepar plant crop cultiv harrow plow numer system have been develop cultiv crop long histori agricultur includ terrac cultiv agroforestri crop rotat shift agricultur other more inform about cultiv soil tillag
101,0,cannabi plant morocco nation regulatori agenc overse cannabi medic first time thursday last step befor legalis world cannabi resin produc north african nation adopt provision authoris legal use cannabi medic cosmet industri use task nation agenc overse process chair interior minist abdelouafi laftit nation agenc regul cannabi activ approv organis chart budget year also read nairobi ganja babi kenya puff keep doctor away agenc will respons control stage product chain from import seed market cannabi product will also includ overse licens procedur nation intern oper legal cannabi industri agenc will also establish cooper local farmer cannabi output north african countri estim total more than tonn studi global initi against transnat organis crime accord report unit nation offic drug crime unodc morocco world biggest produc cannabi resin hashish ban morocco been toler cultiv provid livelihood least famili farm across some hectar acr also read time legalis medic marijuana farm concentr impoverish northern mountain kingdom hope that cultiv cannabi medic will becom lucr busi place morocco global market accord morocco interior ministri market worldwid grow annual rate percent percent year europ onli technic decre remain adopt befor full legalis plant recreat cannabi howev will remain prohibit come alway look way improv stori know what like what improv emerg that last minut intervent presid kenyatta facilit musyoka return azimio fold from cent household head singl parent number shot stagger four three year thi will karua first visit nyanza sinc unveil odinga run mate have blocker pleas disabl reload page again later nation media group welcom
102,0,exist debt both social financi cost ritesh barot busi financi analyst take year tree grow moment fell likewis debt econom crise obstruct revers decad gain capita incom thwart effort poverti reduct develop countri exist debt both social financi cost accord develop programm heavili indebt poor countri have higher rate infant mortal diseas illiteraci malnutrit than other countri develop world japan veri wealthi nation with third largest financi asset world also happen have greatest debt howev they have avoid situat debt crisi they manag their borrow over recent past mani economi have fallen prey debt crisi go back collaps iceland bank system caus financi emerg impact spread across portug itali ireland greec spain well other neighbour countri crisi collaps their econom financi wellb thi year wit lankan debt crisi onc consid great success develop world meet basic human need incom countri late lanka epicentr worst debt econom emerg sinc countri independ nation brink bankruptci thi situat brought cycl ever increas foreign debt chang weather pattern that neg affect crop harvest export onset covid lead seri lockdown soar inflat shortag fuel suppli enorm deficit economi balanc payment drastic deplet foreign currenc reserv progress devalu currenc world econom forum global risk report govern have default debt sinc report there have been increas disburs loan nation particularli across africa asia covid rais debt distress predominantli incom nation emerg market economi rare occurr that rise sovereign debt time high caus bankruptci statu zambia borrow billion from intern creditor default debt repay other noteworthi countri which have default restructur debt after payment sinc year besid zambia lanka includ lebanon beliz argentina surinam mani other lebanon onc refer switzerland middl east econom power region today brink bankruptci what caus debt crisi preval mani countri have suffer econom downturn brought covid thereaft continu impact suppli chain shortag essenti lead escal cost good geopolit damag situat even further from russia ukrain down region polit sever countri across africa have debt total more than percent their gross domest product thi confirm report indic countri includ south africa ghana kenya eritrea congo angola mozambiqu other watch list be heavili indebt kenya fare well compar some african counterpart howev have challeng govern kenya default debt repay three loan amount billion from intern bank financi year end june loan default were secur construct arror itar kimwar dam thi reveal auditor gener audit report countri public debt kenya public debt current stand trillion govern maintain that countri debt sustain there caus alarm gener public debt been subject intens debat even nation treasuri maintain that debt level be percent countri gross domest product economi public remain safe space nanci gathungu auditor gener kenya state taxpay bear burden incur commit fee loan that nation treasuri disburs these revel auditor gener time when nation treasuri propos through financ bill revis kenyan debt ceil from present trillion percent countri gross domest product propos current be deliber nation assembl financi plan committe look larger pictur global economi continu face challeng kenya uniqu with ever rise fuel cost increas inflat impact growth tighten financi condit thi predica face mani nation surpris that world poorer nation have taken increas amount variabl rate debt share their total debt increas their vulner rate hike high rise stock govern debt risk lead higher tax futur ever rise mountain debt expens servic potenti signific opportun cost govern high tax interest rate crowd privat sector well support small govern believ state spend borrow servic loan wast showcas alloc ineffici cut nation debt allow lower tax which increas both aggreg demand aggreg suppli long high level nation debt concern thi depend part root caus debt both cyclic structur also depend part cost annual interest payment repay term exist debt abil govern attract investor debt import factor what most import requir care realist forecast impact inflat real valu unpaid debt valu judgment about best fund public servic welfar which gener should bear cost pay thi debt thoma jefferson famous quot preserv independ must ruler load with perpetu debt countri must reduc debt evad debt trap ritesh barot busi financi analyst humanitarian conservationist occasion artist recipi honor email protect come alway look way improv stori know what like what improv emerg that last minut intervent presid kenyatta facilit musyoka return azimio fold from cent household head singl parent number shot stagger four three year thi will karua first visit nyanza sinc unveil odinga run mate have blocker pleas disabl reload page again later nation media group welcom
103,0,ofafa jericho calvin were right attempt stop charl odhiambo dagoretti high school dure their school game rugbi match upper hill high school march ayumba ayodi sport writer nation media group popular school tourney blackrock rugbi festiv return saturday after year will featur seven side version first time instead tradit game festiv that alreadi attract team will play from mari school nairobi tournament ordin gregori sang disclos that most school team rebuild after covid pandem henc move resort seven version school gradual get themselv togeth well condit longer version game said sang hope excit play despit long break said sang thi will edit festiv that will spice saint alumna touch rugbi where presid uhuru kenyatta former student school been invit host mari school most success team event with titl rift valley academi with eight win among school that will featur saturday mari school championship last while last held titl other confirm team ofafa jericho high school champion inaugur champion nairobi school champion strathmor three time winner lenana school winner upper hill school also enter mutuini dagoretti high school reign champion sang said team will drawn four pool with some provid team team from each pool will proceed main quarter final loser quarter will play plate semi final while third place team pool will play bowl semi final blackrock festiv that kenya futur rugbi star identifi most valuabl player from thi festiv have gone shine club rugbi some notabl one includ former kenya intern allan hick innoc simiyu captain both kenya kenya seven come alway look way improv stori know what like what improv emerg that last minut intervent presid kenyatta facilit musyoka return azimio fold from cent household head singl parent number shot stagger four three year thi will karua first visit nyanza sinc unveil odinga run mate have blocker pleas disabl reload page again later nation media group welcom
104,0,obsess about person your partner cheat with simon mburu report nation media group cheat make marriag stronger accord five year research project univers washington publish journal coupl famili psycholog research practic possibl coupl have suffer infidel enjoy post affair marit stabil trustworthi same coupl didn suffer infidel infidel doe have relationship coupl work through infidel restor their relationship enjoy stabl satisfi marit relationship research wrote addit when infidel confess oppos discov both partner more will work restor relationship accord research project coupl surviv infidel were those willingli subject themselv relationship counsel session happen accord zelda west mead marriag research author love honour betray work what went wrong first ultim goal that should salvag your marriag when have talk through have decid affair over still want your marriag work what went wrong say instanc could that were neglect each other emot sexual need research conduct use data from date site ashleymadison reveal percent women cheat their husband essenti look passion have zero interest end their marriag these find reflect marit disharmoni sexual monotoni social fact long term monogam relationship like marriag longer relationship progress more like qualiti frequenc will fade use bore same bodi said eric anderson lead research professor masculin sexual sport univers winchest england separ sexual life your partner have look separ sexual life feel more want lust after attract appreci psychologist munyua say such need want point deeper emot problem bedevil marriag your partner will rare cheat with stranger will acquaint they have been engag with under guis just friend accord american associ marriag famili therapi platon relationship where parti marri hold great potenti evolv into emot affair that quickli includ emot intimaci secreci sexual chemistri level higher than those marriag turn page iron cheat could fodder your marriag need grow stronger howev will need evalu what need want weren get your union mayb your drive seek elsewher illumin fact that your life optim that haven been work toward satisfi life perhap been feel valid area love that drove seek connect with someon els say michael broder psychologist author your relationship save know whether stay marriag will onli reap from unfaith both guilti innoc parti will walk rough road toward total reconcili fail tackl eleph your bedroom prior affair confront head immedi rest assur your marriag hous card that could blow minut say final your spous cheat work reconcili avoid dredg past whenev have argument obsess about person your partner cheat with either do will entrench your pain while reinforc your anger disdain say broder choos develop civil thought discuss about what need chang work immedi your marriag path recoveri emerg that last minut intervent presid kenyatta facilit musyoka return azimio fold from cent household head singl parent number shot stagger four three year thi will karua first visit nyanza sinc unveil odinga run mate have blocker pleas disabl reload page again later nation media group welcom
