,title,text
151,1,margaret njenga farm kiserian kajiado counti grow onion capsicum tomato spinach cabbag collard green beetroot peter changtoek cool breez waft from plain yonder approach corner baridi kiserian kajiado counti area cool name loos suggest ten bungalow maisonett area own kenyan seek seren they work nairobi where life fast pace howev corner baridi onli residenti commerci farm taken root here with resid like margaret njenga lead from front year farmer busi onion farm with worker when seed gold team arriv cut leav plant bulb market thi last harvest say margaret supervis worker have reduc number from previou have done harvest day besid onion margaret also farm four acr capsicum cabbag spinach collard green tomato beetroot well lucern five dairi cow also keep goat chicken rabbit ornament bird young farmer alumnu john teacher train colleg kilimambogo quit teach engag mix farm taught about four year then covid happen march when school were shut move kiserian parent home start farm quit teach concentr farm after realis well pay say margaret initi do telephon farm while teach onion favourit crop their good return farm them under irrig acr rest crop about quarter acr each start farm onion half acr invest capit money that went instal drip line prepar farm buy seed explain read gilad millo song garlic farm then expand anoth half acr where increas number drip line more yield spend seed among most expens input say note buy kilo crop take day nurseri day field after transplant add margaret accord harvest tonn onion from eight that would when telephon farmer current sell kilo onion what say best price onc sold onion worst thing grow them small portion better invest farm acr three higher tonnag higher incom manag crop greatli determin what harvest when tonn everi four five month that come over million have three season year say sell onion trader from wakulima market nairobi visit farm they collect them from farm same case with tomato say farmer margaret njenga farm kiserian kajiado counti read boom farmer spice earn grow garlic rotat onion with tomato cabbag that take three month matur advantag mix farm that fail some money onion take some four month matur wait sell cabbag tomato thu incom through year like salari person say margaret grow seedl insid greenhous tray cut cost product grow collard green cabbag money sustan farm onion main crop use manur from livestock grow crop buy more from neighbour say soil test vital guid accord soil analysi report plant with manur after week appli after four week appli say margaret challeng high cost electr especi when come pump water also say farmer have standard price produc what make buyer take advantag them sell onion kilo somebodi els sell standard price will make good profit some diseas grappl with downi mildew purpl blotch bulb pest such thrip caterpillar there pesticid market curb them when water crop even minut onion consum much water dure first month after transplant second month howev when they form bulb they requir littl explain keep chicken kenbro kienyeji varieti meat egg read tear michael macharia juggl music onion farm last month bought chick sold after month each say sell matur kienyeji cockerel each hen goe rabbit beauti there those friend left nairobi they request farm visit even parent children where use teach request visit thi farm home also resourc centr start with three they eight five cow them calv down last year they milk over litr sell cooper societi kiserian litr morn suppli litr noon suppli litr even suppli say farmer advic aspir farmer onli need water determin hope mani peopl quit teach person decis your goal say margaret plan ventur into valu addit think what onion increas shelf life also tomato make past sauc more money carol mutua crop product specialist from egerton univers say higher yield best qualiti bulb onion should grown area with altitud abov level although reason harvest realis lower altitud bulb form rel high temperatur tropic temperatur suffici induc bulb even high altitud veget growth best occur temperatur less than bulb form temperatur abov bulb assum matur befor they reach econom size result yield email protect come alway look way improv stori know what like what improv gachagua said busi unit leader they have accept their kenya team captain nyaguthii took care muriithi after suffer domest violenc attack peter mwanzo charg kasarani polic divis lost within hour have blocker pleas disabl reload page again later nation media group welcom
152,0,averag adult need hour sleep night function well dure fiona muthoni studi show that peopl regularli sleep less than hour night more like depress have higher rate suicid self harm reason thi correl that when bodi doe enough rest releas hormon call cortisol which increas stress level brain when enough sleep produc less serotonin thi increas anxieti know someon with depress encourag them plenti rest sleep depriv refer lack sleep have enough hour hour period entir refresh oneself natur bodili purpos such heal growth regener effect get enough sleep includ irrit anxieti problem concentr rememb thing weight gain increas risk diabet lack sleep also lead increas feel sad hopeless which trigger thought suicid sleep depriv person like have these symptom first probabl most common caus sleep depriv sleep enough averag adult need hour sleep night function well dure less sleep lead drowsi troubl concentr well irrit mood swing second major caus sleep depriv sleep debt which develop over time when individu consist sleep less than their bodi need some factor which increas person risk develop sleep debt includ stress lifestyl babi home chang work hour exampl when return work after matern leav they have been use sleep longer hour suddenli have work dure take care babi night easi such person develop sleep debt peopl suffer from depress tend have higher rate sleep depriv thi becaus they often lack motiv energi make difficult them morn alon reason time each night addit mani peopl with depress have insomnia other sleep disord such restless syndrom which make difficult fall asleep peopl with depress also more like engag unhealthi behavior such smoke drink alcohol excess take over counter medic prescript medic which disrupt sleep pattern addit when individu depress enough sleep frequent lead other depress feel their bodi have energi motiv want accomplish anyth here what help yourself feel depress easi mani peopl with depress becom discourag lose motiv when they cannot good night rest thi make even difficult them function well dure trigger addit feel sad despair when peopl becom depress import that they seek help from specialist combat symptom their live back track again identifi enhanc thing that help your spous maintain healthi mental trajectori within your environ find way commun that will make your partner feel heard valid close emerg that last minut intervent presid kenyatta facilit musyoka return azimio fold from cent household head singl parent number shot stagger four three year thi will karua first visit nyanza sinc unveil odinga run mate have blocker pleas disabl reload page again later nation media group welcom
153,0,ukrainian presid volodymyr zelenski left talk with servicemen dure visit kharkiv region ukrainian presid volodymyr zelenski sunday made first trip countri torn east sinc launch moscow invas russian forc tighten their grip around citi donba region zelenski offic post video telegram wear bullet proof vest be shown destroy build kharkiv surround from where russian forc have retreat recent week sinc fail captur capit kyiv earli stage russia shift focu eastern donba region attempt consolid area under control forc said saturday they captur lyman contest region were up pressur twin citi severodonetsk lysychansk zelenski been base kyiv sinc russian presid vladimir putin launch full scale attack ukrain februari thi occupi tri squeez least some result zelenski said later telegram post sunday they should have understood long that will defend land last ad ukrainian presid speak european union leader emerg summit monday decid russian embargo member state were consid exclud russian pipelin they sought break deadlock sixth round econom sanction sourc told situat lysychansk becom significantli wors region governor lugansk region sergiy gaiday said telegram russian shell fell residenti build girl die four peopl were hospitalis said other bank donet river russian forc carri assault oper area citi severodonetsk accord ukrainian gener staff fight citi advanc street street gaiday said embattl citi where estim civilian remain local offici said constant shell made increasingli difficult evacu veri unsaf isol case when manag peopl prioriti wound peopl need seriou medic assist said oleksandr stryuk head citi militari civil administr water suppli also increasingli unstabl resid have gone more than week without mobil phone connect ad sunday russian defenc ministri said destroy ukrainian arm forc arsen south eastern citi kryvyi with long rang high precis missil russian forc also target ukrainian anti defenc system near mykolaivka donetsk region well radar station near kharkiv five munit depot close severodonetsk zelenski discuss reconstruct plan with local offici trip kharkiv say there chanc area devast russian attack have face accord local offici over apart block have been wholli partial destroy russian shell region citi kharkiv itself custom were return well known crystal cafe central public park after reopen door april resid come coffe bite sampl biloshka cream crystal special vendor been serv sinc need keep employ citi come back littl littl cafe manag alyona kostrova told menu been trim suppli problem local oper with reduc staff down seven eight from befor from citi centr neighbourhood saltivska where russian shell continu fall atmospher differ would that peopl buy peopl have money said vitali kozlov peddl egg meat veget local volodymyr svidlo told pension come onc week neighbourhood sell item such onion dill flower from garden order make end meet zelenski will speak leader their emerg seek crank intern pressur moscow round european sanction been held hungari whose prime minist viktor orban close relat with russian presid vladimir putin landlock countri depend most need russian crude suppli druzhba pipelin hungari ask least four year million euro million fund adapt refineri pipelin capac altern supplier like croatia under propos nation negoti sunday druzhba pipelin could exclud from sanction packag which would onli target ship tanker come alway look way improv stori know what like what improv emerg that last minut intervent presid kenyatta facilit musyoka return azimio fold from cent household head singl parent number shot stagger four three year thi will karua first visit nyanza sinc unveil odinga run mate have blocker pleas disabl reload page again later nation media group welcom
154,1,tri coriand farm after talk local farmer told herb usual high demand price produc great last clincher that buyer would come harvest pack coriand transport market harvest coriand first crop plant just row greenhous tunnel sinc never plant befor when readi feeler best sell produc farmer area fame coriand farm came inspect what advis that what joke told that good return need plant least quarter acr view bigger area better offer that seriou pursu coriand farm will show rope even will money where mouth partnership discuss offer that would seed fertil fungicid insecticid half labor provid land other half labor project that onc coriand crop harvest would money bank track record hook first plant acr coriand area plough then creat furrow hand with help some labor whom work right next seed sow scatter method when thi ask plant would grow manag sow that answer that cover seed then done drag feet transvers opposit line direct thi assur over seed end row must that when crop germin blown away clean row coriand grew sinc after initi first acr still some land that fallow advis that should plant anoth crop fallow land that manag market stagger advis that would plant week later from experi coriand manag difficult thing that must manag water irrig fungal diseas fungal diseas that affect crop caus unsightli black spot which lower market produc weed last issu sort which control select chemic agent urea appli field onc when crop grow thi ensur good veget growth first crop went well until point where weather start chang morn there some realli frost wipe most crop inspect plant plot there salvag situat thi point which knew farm never count your chick befor they hatch couldn believ that that work effort could wipe morn second crop better were more keen manag howev there aros problem there some rain while crop grow when rain stop devis irrig irrig system place inadequ could onli irrig area about acr petrol driven pump when connect didn have enough power pump water water crop long stori short that crop also bust harvest mix about half crop nice green healthi while other water issu caus thi outcom onli aspect that were unabl mitig water issu caus price crop even enough break even onli cover cost input labor thi point felt veri disillus more about coriand farm there peopl still swear feel otherwis wold grow again experi with trial were good with especi frost issu live highland will make more attempt coriand farm whether such commod recent time haven heard good tide from grow crop think thi becaus there time profit grow coriand hype grew opposit happen return market becam satur with back farm journey
155,1,infospac ultim inform space thi profit tomato farm kenya definit guid with inform answer guid tomato farm kenya want start commerci tomato farm tomato farm domest purpos thi guid prepar specif befor ventur into tomato farm kenya there some question have been ask yourself intend answer these question thi guid grow tomato kenya plant consid follow action ecolog requir tomato farm soil should deep well drain loam soil water should avail area where tomato plant consid instal water tank area where tomato plant should gentli slope land also import note that tomato cannot plant immedi land where potato pepper have been plant tomato normal grown from seedl step into next step which seedl prepar tomato nurseri prepar rais nurseri width length your conveni farmyard manur with soil nurseri prepar furrow like line across nurseri with suitabl space between row seedl from sachet cover with uniform light soil dure thi period mulch nurseri continu water weed continu until period transplant mulch remov soon seedl appear around day transplant actual land done after week transplant done even where seedl uproot from nurseri with lump soil their root seedl should plant well prepar land free from weed hole actual field should with space plant seedl with hand compost farmyard manur phosphat fertil appli base root develop fertil also use dresser leaf develop flower tomato begin week after transplant farm practic tomato your tomato continu matur farm regular farm practic continu tomato support thi done use light pole each plant where tomato tie use string follow pole upward thi increas product tomato avoid stem damag dure support prun thi remov side shoot sucker also yellow wilt plant should prune soil condit thi done applic manur soil thi done moder much nutrient littl nutrient damag your tomato plantat weed thi remov unwant plant area where have grown your tomato weed harm proper growth tomato monitor thi done frequent check pest diseas some pest invest potato make necessari integr pest manag practic pest affect tomato includ american bollworm diseas tomato blight bacteri wilt blossom follow farm practic tomato farm within matter week your tomato should grow vigor rapidli harvest tomatoeswhen tomato produc ripe fruit first harvest readi thi alway day after plant depend varieti ecolog condit facilit proper harvest tomato fruit should pick care avoid damag plant market after success harvest your tomato readi market after storag crate tomato sold kilogram variou market around kenya acr tomato plantat produc ton tomato under good mainten tomato kenya cost ksh which vari accord time avail thi should proof profit tomato farm kenya there alway readi market your tomato kenya market tomato school institut fast food chain hotel open market also read your email address will publish requir field mark comment name email websit save name email websit thi browser next time comment
156,0,maosoleum koitalel arap samoei nandi leader nandi hill town photo rupi mangat rupi mangat nandi chief resist their land be grab turn centuri celebr here mausoleum open then presid mwai kibaki cool afternoon atop nandi hill while golfer take first picturesqu nandi bear club boast most scenic fairway line with tower indigen tree walk short distanc into museum dedic famou nandi leader koitalel arap samoei portrait koitalel arap samoei nandi leader museum nandi hill town photo rupi mangat mausoleum open then presid mwai kibaki step insid impress build larg empti save four pillar grave chief kill cold blood octob british administr colonel meinertzhagen near mausoleum ground present golf club koitalel head sever sent england hasn been return nandi were oppos their land be taken railway understand curat franci thalam escort around singl storey coloni hous mausoleum which serv court hous befor be turn into museum first glanc singl room museum look complet uninterest with artefact pictur know anyth about histori easi ignor thalam narrat event from past three long staff that belong nandi leader still stand encas glass metal that first visit more than decad they were symbol samoei govern each repres administr militari religion taken away from commun england coloni power three staff were return after mani decad hous call barsirian manyei name after leader becam freedom fighter barsirian arap manyei april last wide recognis nandi orkoiyot leader kenya longest serv polit detaine captur coloni british barsirian spent year exil shuttl from prison prison place like mfangano rusinga island lake victoria kapsabet flung meru maosoleum koitalel arap samoei nandi leader nandi hill town photo rupi mangat when barsirian suppos brought back nandi hill coloni govern sens troubl nandi would demand releas their leader henc barsirian ship back mfangano island onli releas after kenya independ barsirian move uasin gishu array sepia imag show nandi play part histori with artefact collect thalam date back centuri more like year buffalo hide shield clawless african otter display anim rever nandi becaus peopl clean water rememb those day there were tap indoor plumb ethiopian jiko resembl nandi jiko which thalam theori about that nandi follow nile into kenya keen anthropologist thalam kalenjin publish book about commun slight drizzl begin walk back golf club thi time vanish into pine woodland be clear search spot where koitalel murder cold blood guid stop huge boulder plant forest tall tree thi where nandi leader use hold court tell guid place where koitalel arap samoei murder same spot anoth area unknown guid drive down nandi hill through long wind road wedg between steep hill valley there spectacular show rain lightn from tinderet turn sky electr white with fieri rod fact file check kweiso hous nandi bear club golfer explor mani site long stretch nandi hill like bonjog nation park also call nandi rock south nandi forest hike bird cultur tour like museum dedic nandi leader koitalel arap samoei prehistor site songhor fort ternan includ uganda railway relic fort ternan also drive kisumu kericho eldoret rupitheafricantrott feedback editor write email protect come alway look way improv stori know what like what improv emerg that last minut intervent presid kenyatta facilit musyoka return azimio fold from cent household head singl parent number shot stagger four three year thi will karua first visit nyanza sinc unveil odinga run mate have blocker pleas disabl reload page again later nation media group welcom
157,0,mose wetang left musalia mudavadi requir bring cent western vote william ruto presidenti ticket letter kenya kwanza allianc deal wherebi former vice presid musalia mudavadi prime cabinet secretari bungoma senat mose wetang nation assembl speaker recent headlin deal western counti busia bungoma kakamega vihiga would take cent govern appoint posit share promis sound good convinc trick lie condit mudavadi wetang requir bring cent western vote william ruto presidenti ticket thi seem tall order mudavadi made first stab presid unit democrat front ticket raila odinga took third shot seat ticket under cord coalit while raila manag impress second place with cent after presid uhuru kenyatta mudavadi underwhelm third with onli cent nation talli mudavadi western backyard kakamega vihiga busia bungoma onli cent vote raila cent home counti vihiga cent vote against raila cent wetang cent vote bungoma their combin effort therefor would wield roughli cent when mudavadi join raila latter bag cent western vote henc mudavadi could onli have brought cent more vote ticket that entir credit raila increas popular owe local pointmen such kakamega governor wycliff oparanya dynam have chang quit significantli again some local raila heavyweight have gain more public becaus work devolut besid wetang ford kenya mudavadi face veri aggress newcom wafula wamunyinyi kenya equal noteworthi mass defect from parti upon join deputi presid ruto which their influenc region take beat onslaught from thi combin factor go make thing easier fact they will even fewer vote than past poll just other ruto express disdain coalit intent been build have onli parti advanc agenda partner with mudavadi wetang tactic optic move meant give region like western impress that their interest repres polit movement deal deal ruto inner power circl littl chanc deliv ruto camp unwil grant their wish unreason high target them should therefor stop lie their constitu bwire mugolla nairobi come alway look way improv stori know what like what improv emerg that last minut intervent presid kenyatta facilit musyoka return azimio fold from cent household head singl parent number shot stagger four three year thi will karua first visit nyanza sinc unveil odinga run mate have blocker pleas disabl reload page again later nation media group welcom
158,1,grew thi crop part fodder crop also crop rotat littl research show that crop like sunflow good crop rotat program they have deep root thi would help keep soil structur nutrient balanc especi when rotat with shallow root crop like maiz sunflow gener difficult crop grow spray program mostli control insect much form fungal diseas that affect most peopl round farm couldn understand would want sunflow farm especi fodder crop howev research seen that good energi sourc requir shorter grow period compar maiz which most popular crop fodder sunflow variou varieti tri hybrid with content well hybrid high content hybrid high content seem better guess better genet through hybrid vigour thought heliotrop myth sunflow plant follow cours throughout onc plant develop flower actual wit fascin flower head face east came west when natur amaz didn crop sunflow matur soon plant flower fill their flower head about half harvest crop chop ensil must most appet feed cow mayb becaus they weren use cow never realli sunflow silag with zest they maiz sorghum silag anoth reason sunflow becaus knew good forag crop bee also want tast what honey would tast like when bee forag sunflow howev time sunflow crop harvest bee enough honey comb wait anoth month tast sunflow infus honey rememb some nice smell tast thi especi becaus most honey consum harvest lowland which hotter drier mayb lack diversifi forag make honey have much bouquet problem with sunflow farm bird these littl critter tenaci employ number method from hang wind blown shini artifact farm actual employ someon shoo away bird left uncheck these caus loss crop would grow again sunflow good crop take care earli stage headach come onc they have head which fill with seed thi most tiresom stage also becaus onli farmer grow crop about radiu acreag small reason much bird troubl bird problem alon which guess even with larger acreag will still compound wouldn grow sunflow again back farm journey
159,1,editor will review what submit determin whether revis articl editor will review what submit determin whether revis articl slash burn agricultur method cultiv which forest burn clear plant slash burn agricultur often use tropic forest root crop farmer variou part world anim graze south central america rice cultiv forest hill countri southeast asia provid some fertil plot rel free weed after sever year cultiv fertil declin weed increas then tradit practic indigen peopl subsist farmer area would left fallow revert secondari forest bush cultiv would shift plot after about decad site could reus such practic consid sustain they requir outsid input such synthet fertil small clear recov forest over time also shift agricultur earli centuri howev clear area were typic maintain deforest state perman caus habitat fragment biodivers loss although tradit practic gener contribut greenhous gase becaus their scale modern slash burn techniqu signific sourc carbon dioxid emiss especi when use initi perman deforest forest sequest carbon form wood other biomass tree grow take carbon dioxid from atmospher when forest burn their carbon return atmospher carbon dioxid potent greenhous that alter global climat global warm tree longer present sequest more carbon southeast asia slash burn agricultur palm cultiv been major sourc annual pollut from smoke although thi form agricultur strongli associ with deforest tropic rainforest such amazon slash burn practic also respons loss larg area tropic forest where season permit better burn
