,title,text
0,0,from left charl nasieku nation vice chair bahlita simon njorog nation chair bahlita daniel ouma chairperson bahlita kisumu wangu kanuri hotel liquor trader associ bahlita blame effect covid rise number peopl be drug mchele befor be defraud they said liquor luxuri that mani kenyan avoid height pandem they purchas some drinker overindulg measur have been adopt curb mchele case said bahlita secretari gener bonifac gachoka have written director crimin investig boss georg kinoti provid team offic will help elimin thi boom busi said bahlita would work with pharmaceut societi kenya identifi chemist sell drug peopl involv mchele busi read murang policeman want boss apologis wife echo need erad mchele bar daniel ouma chairperson bahlita kisumu branch said they ask owner instal cctv camera educ waiter manag bouncer first care onc client been note sleepi drowsi first thing should wake them respond offer first advis person respons lace drink identifi liais with polic track suspect post them social media platform drug mainli use dure surgeri anaesthet treat psychosi high dose caus death perman amnesia sleepi that last sever day last week across social media platform have lament mchele with some disclos that they lost their properti money address issu affect owner bahlita chair simon njorog complain about propos increas excis duti beer spirit say that tax adopt there would increas illicit alcohol trade kenyan would start smuggl cheap product from other market nation treasuri financ bill propos increas excis duti alcohol beverag these rate beer percent spirit percent glass bottl excis percent also want percent rise advertis fee alcohol product also read mchele gang with bhajia desperado nairobi woman swindl govern should cognis current hard econom time that kenyan go through burden them further through harsh law that risk push thousand kenyan job propos excis duti will onli affect manufactur farmer also busi consum njorog said claim that peopl work bar hotel lost their job dure covid period onli current employ njorog warn govern that thi number would decreas they pass bill increas tax beer primari consum barley sorghum with declin beer volum farmer will forc down product henc loss livelihood reduc nois pollut from entertain zone njorog said they encourag creation whatsapp group where owner neighbour their grievanc alleg racism some club with most recent incid involv alchemist westland nairobi bahlita condemn such behaviour commend nairobi governor ann kananu decis close down claim investig email protect come alway look way improv stori know what like what improv emerg that last minut intervent presid kenyatta facilit musyoka return azimio fold from cent household head singl parent number shot stagger four three year thi will karua first visit nyanza sinc unveil odinga run mate have blocker pleas disabl reload page again later nation media group welcom
1,1,editor will review what submit determin whether revis articl editor will review what submit determin whether revis articl crop rotat success cultiv differ crop specifi order same field contrast crop system haphazard crop success throughout human histori wherev food crop have been produc some kind rotat crop appear have been practic system central africa employ year rotat singl crop finger millet produc after year growth woodi shrub tree been burn major food produc region world variou rotat much shorter length wide use some them design highest immedi return without much regard continu use basic resourc other plan high continu return with protect resourc underli principl plan effect crop system began emerg middl year centuri earli experi such those rothamst experiment station england centuri point use select rotat crop from three classif cultiv close grow grain form rest crop such classif provid ratio basi balanc crop interest continu soil protect product economi suffici flexibl adjust crop mani situat make chang when need includ between crop cover green manur simpl rotat would crop from each group with ratio first number rotat ratio refer cultiv crop second close grow grain third form rest crop such ratio signifi need three field three year produc each crop annual thi requir would satisfi with rotat corn oat clover potato wheat clover timothi rotat number field crop relationship describ thi manner gener most rotat confin time limit eight year less acreag devot form rest crop should expand expens crop soil increas slope declin fertil thi will provid better veget cover protect slope land from excess eros suppli organ matter improv soil product both slope level land with lessen slope increas fertil crop expand thi should done with much reduct form crop differ effect crop soil each other reaction insect pest diseas weed requir care plan sequenc broadli speak crop system should plan around deep root legum littl made them product will declin much land devot them wast occur other use crop will displac rotat depend wholli green manur legum should confin more level fertil land desir includ legum alon mixtur with nonlegum form crop regular crop mani field rotat gener thi should occur about onc each four year period short rotat like provid best crop balanc long rotat larger number field introduc complic with moder number field addit flexibl provid split crop some field use individu field crop affect region differ climat soil major crop region have littl valu anoth each region howev there usual grain rest crop that brought togeth into effect crop system addit mani benefici effect soil crop well plan crop rotat also provid busi aspect farm with advantag labour power equip handl with more effici weather market risk reduc livestock requir more easili farm more effect year round enterpris also norfolk four cours system field system three field system
2,0,vaccin most import invent field medicin fiona muthoni from menstrual cramp ovarian cancer there number health concern that women have deal with regular basi while some mere affect their daili activ other life threaten howev thank health invent women have access tool technolog that help them overcom these challeng here some incred health invent that have been develop specif women menstrual cup menstrual silicon insert into vagina collect menstrual blood worn long hour wash reus menstrual friendli cost effect conveni altern pad tampon there variou size menstrual cup depend flow whether woman given birth vagin consult gynaecologist will help choos perfect menstrual pregnanc pillow pregnanc pillow larg shape pillow design provid support pregnant women help with sleep sit even breastfeed pregnanc pillow help allevi common problem such back pain neck pain stomach pain breast pump breast pump devic that help extract milk from breast lactat women use store milk later feed babi directli breast pump help women want continu breastfeed after return work also benefici women wish increas their milk product breast pump electr manual consult doctor befor use breast pump post natal girdl post natal girdl garment that help support abdomen improv postur after give birth name suggest worn after give birth other benefit such post natal girdl avail differ size import choos right size tampon tampon type feminin hygien product that insert into vagina absorb menstrual blood they avail differ absorb tampon made cotton rayon both tampon safe have number benefit such import chang tampon everi four eight hour ovul predictor ovul predictor help women predict when they ovul help with fertil treatment avoid pregnanc ovul predictor test lutein hormon level urin easi purchas from pharmaci onlin store with increas women struggl conceiv ovul predictor becom essenti mani coupl vaccin vaccin most import invent medicin they have help save million live prevent deadli diseas vaccin protect against human papillomaviru viru that caus cervic cancer vaccin given girl age nine thirteen women have never form sexual contact vaccin most effect way prevent cervic cancer other type cancer therefor import receiv vaccin young contracept method there number contracept method that avail women these includ invent these contracept spearhead revolut women health each woman uniqu need prefer import find contracept method that work best also advis consult doctor befor choos contracept method menorrhagia frequent heavi menstrual bleed that impact woman physic emot health miscarriag pregnanc that end befor week which befor most develop babi abl surviv outsid womb uteru emerg that last minut intervent presid kenyatta facilit musyoka return azimio fold from cent household head singl parent number shot stagger four three year thi will karua first visit nyanza sinc unveil odinga run mate have blocker pleas disabl reload page again later nation media group welcom
3,0,wanjiku kibe faith muiruri ann wanjiku kibe rose polit fame after landslid victori that becom first woman elect gatundu north howev short live when court nullifi thi follow petit oppon challeng rule suprem court which upheld elect befor dust could settl slap with anoth petit seek nullifi elect petition argu that qualifi seat becaus date elect resign nomin member kiambu counti assembl thi path unend court battl which continu until around februari thi year these were most depress moment polit career fight hard retain seat remain track deliv promis read wanjiku kibe promis transform gatundu north elect approach august poll former radio present kamem upbeat that will reclaim seat continu develop project vy against more than five competitor oppon move court becaus they believ woman leader they attest transform constitu among achiev over past five year revamp infrastructur public primari school constitu dilapid facil have been renov classroom built have also ensur that needi children receiv bursari from bursari kitti infrastructur kibe also push rehabilit reclassif thika gako magumu flyover road from class under counti govern nation govern road abl lobbi nation govern tarmac over kilometr road have also establish innov centr prepar operationalis innov creativ centr line with ministri polici say these hub will nurtur centr that will greatli benefit youth thi digit through what known ajira programm other success includ electrif have instal street light improv secur spur hour economi have also manag light over major centr partnership with kenya power elect prioriti includ set endow fund ensur needi student fulli support throughout their educ say bursari kitti cover onli cent beneficiari limit number beneficiari youth empower say have been abl innov centr constitu that operationalis elect will ensur these centr becom function construct addit centr everi ward plan creat databas skill set then link young peopl with privat sector establish technic train institut ensur major youth equip with skill requisit market kibe hold bachelor art educ from kenyatta univers master busi administr from univers nairobi sit energi commun inform innov committe parliament express confid retain seat ad that even smear campaign charact assassin oppon will derail malici falsehood smear campaign work use against elect constitu want servic they want person they easili identifi with leader with develop record understand them glad that none oppon tangibl evid against perform misus constitu develop fund alloc bursari fund other public fund have been mention corrupt alleg base campaign perform that made campaign easier optimist go back parliament gatundu north second term say confid kibe addit believ gender card will work have alway present myself mother regard highli commun ralli call thi campaign njorua wira mean champion work which reson with elector despit bruis court battl have alway manag find enough time with voter say that through these interact with elector that learnt challeng face them while accept encourag posit critic perform thi interact also given opportun serv peopl better have first hand inform issu affect them happiest moment when receiv feedback from commun ongo project share idea discuss issu affect them third gender rule point that kenya progress creat space women especi polit arena cite name martha karua azimio coalit presidenti contend run mate remark thi veri histor moment thi countri becaus have never major presidenti candid pick woman urg women contest polit seat caution them against play dirti have insult your competitor vulgar languag elect still sell your manifesto decent peopl will vote come alway look way improv stori know what like what improv emerg that last minut intervent presid kenyatta facilit musyoka return azimio fold from cent household head singl parent number shot stagger four three year thi will karua first visit nyanza sinc unveil odinga run mate have blocker pleas disabl reload page again later nation media group welcom
4,0,have lost subscrib first time more than decad netflix face challeng stagnat from posit strength drop just user less than percent total custom base enough send wall street panick with share plung more than percent wednesday loss subscrib compani variou plan reviv busi chang histor simpl stori netflix solid success said well fargo analyst price target half outlook clear they said loss subscrib might seem blip first blush netflix signal otherwis compani anticip much larger drop second quarter around million subscrib sure that turn point netflix said scott zari global rate think indic mayb phase slower growth said also read show flexibl news busi bank america analyst said note that netflix made clear that expect veri subscrib growth with margin expans shift felt even tone compani result present tuesday even affair focus less streamer mega hit such bridgerton ozark more combat million household watch netflix free thank share password when were grow fast wasn high prioriti work founder reed hast admit work super hard chief oper offic gregori peter said netflix wasn tri shut down share go more abl share accord zari futur growth will depend they monet those household attract viewer netflix prepar cheaper subscript with advertis which expect roll next coupl year gato california base compani long defend model which apart from competitor such disney appl also read kenya filmmak pocket from netflix pivot analyst jeff wlodarczak stream appear nearli fulli penetr global post covid compani must their sight convert pirat into subscrib gain greater market share from each other drive price increas price help netflix short term though rais fee januari extent that most expens among major streamer think they have adjust their busi said paul hardart professor york univers includ cost side invest content univers richmond professor joel mier netflix price increas axe password share peripher meaning short term solut while long term strategi remain invest local content creation establish game presenc with million subscrib netflix market leader stream space zari said they veri ahead particularli global marketplac said hardart think will give them advantag problem netflix face good news compani emphas global leader whatev netflix goe through other streamer also like face eventu probabl wors news other servic that start build themselv said come alway look way improv stori know what like what improv emerg that last minut intervent presid kenyatta facilit musyoka return azimio fold from cent household head singl parent number shot stagger four three year thi will karua first visit nyanza sinc unveil odinga run mate have blocker pleas disabl reload page again later nation media group welcom
5,1,great uncl were talk when subject keep came told that there compani that sell hive offer train beekeep interest stir when found that harvest honey time year even more depend type hive climat where live idea have mani hive surround area support said that bee forag radiu from site hive that where environ live determin where mani hive keep live dens popul area abl keep bee beehiv there howev somewher citi that urban keep thi properti neighbor hospit toward corner compound there were tall tree plant surround apiari heard that thi good strategi tall tree make bee high when go come into hive thi reduc disturb bee neighbor visit beekeep compani found what they offer then compar lastli visit nation beekeep station here talk beekeep expert also some writeup same also decid start beekeep journey purchas langstroth hive decid site apiari along fenc farm setup entranc hive face fenc use check hive daili activ after about week luck rememb some way bee into inhabit hive there certain scent smell that attract bee that could find lemon grass essenti drop piec cotton wool hive hive were inhabit within week after that after bee settl gave them about month befor ad super langstroth hive box that stack each other bottom call brood where bee setup comb with their young some with honey bottom usual taller that other thi give bee adequ space rear their young grow their coloni other box stack brood call super these separ kind mesh screen thi allow worker bee into super make comb honey prevent queen larger physic from go lay egg super thi mean that super when full onli contain honey make easier harvest kept inspect hive everi week much honey they collect onc they have fill cap cover about comb they consid readi harvest thi import becaus harvest honey stage befor cap even comb full there risk honey go ferment becaus will have high moistur content onc decid harvest prepar smoker wore suit went hive went earli even caus commot onc gone great uncl farm with uncl half journey drive there onc there around midday decid have look possibl harvest honey everyth uncl except second suit didn have glove advis wear some black paper bag cover hand thi later learnt mistak bee appar hate color black onc open first hive bee seem attack more than uncl especi target hand black paper bag offer protect abandon uncl flee sake poor hand endeavour escap wrath bee walk great uncl farm some herder were look after their cattl goat were quick tell their direct anyway after walk about kilomet bee seem abandon chase when back great uncl farm good laugh about what transpir lesson learnt thi when decid better less disrupt harvest honey even when dark approach hive onc open with hive tool cover bar open comb honey into bucket cover time next step extract siev honey which next must that honey harvest from hive some tastiest most fragrant have would again have never stop keep bee thi more after tast what authent honey tast like problem with honey especi store bought around here that most flavor aroma opinion wateri consist would thu stop keep bee love eat authent tasti honey also good earn some money sell surplu honey back farm journey
6,0,cover page richard kioko kiundi memoir through wilder life duke emali prime odhiambo read some book like listen spring race commentari some stori fast pace even page book that left wonder they would told word mouth thi easiest describ richard kioko kiundi memoir through wilder life duke emali afritel publish thi book that reader keep pace with storytel race read more like adventur stori journey that will most like inde life wilder titl kioko stori suggest add imag emali stori begin understand idea life wilder have appear kioko imagin grow area around what today emali time kioko born what could have been see except expans land full shrub tree wildlif what would have been dream young person such place walk walk beyond what could such dream adventur would defin life forev thu kioko stori long adventur that leav reader suspect that what book onli small part longer version kioko born villag kwakakulu then iteta locat masaku coloni district makueni counti march parent nine children eighth child danson kiundu yambu serah mbuve kiundu say that mostli rais elder sister esther ndung bath gener look after kioko would primari school villag befor be admit allianc high school then univers nairobi from where graduat with bachelor commerc account option through wilder life hardli linear stori even though take reader from kwakakulu nairobi where kioko live today with sojourn kilifi taveta where work civil servant nonlinear plot seem deliber storytel suggest that life mere collect experi which captur anecdot impli that there realli stori that defin human be which thi autobiographi read like collect sketch thrown togeth with reader left decid which enjoy most allianc school alumni those interest school there sever tale about kioko time school memori alma mater quit well celebr teacher taught those head institut from birth time write book there lesson here million individu there pass through school whose live were shape teacher hardli have much about their former school kioko also stori escapad young school tri smoke alcohol endless interest young women kioko still manag pass level exam univers kioko work life begin kilifi where post district account just befor graduat from univers describ time kilifi some kind adventur where made friend indulg weekend parti seem enjoy work howev seem have fallen afoul some district commission which eventu post taita taveta district would leav civil servic when offer motor mart group then part lonrho multin corpor kioko left motor mart group voluntarili would immedi thereaft join kenya pipelin corpor where work till kioko dismiss from allegedli be respons forgeri loss compani money employe claim subsist allow work that done kioko say that wasn given fair chanc defend himself when took former employ court lost case victim workplac vindict just innoc caught shadi deal that happen time some public corpor kioko stori resili weather loss lost invest money friend conmen lost famili member live with death belov endur pain suffer from cancer which manag beat these experi seem have taught veri person lesson which captur reflect memoir say have also learnt that there absolut truth that entiti hold knowledg howev have learnt live live expect reciproc treatment well follow conscienc other what would expect done under same circumst with confid that have been free live life best know without look over shoulder through wilder life duke emali stori that rival mani self help motiv book here stori show incred belief abil desir succeed time although reader left wonder what behind stori told longer more interest what kioko offer captiv medley anecdot that take reader through rough ride that life kioko becam duke emali find from book itself writer teach literatur perform art univers nairobi email protect come alway look way improv stori know what like what improv emerg that last minut intervent presid kenyatta facilit musyoka return azimio fold from cent household head singl parent number shot stagger four three year thi will karua first visit nyanza sinc unveil odinga run mate have blocker pleas disabl reload page again later nation media group welcom
